{
  "id": "33333333-3333-4333-8333-333333333333",
  "name": "Local",
  "_postman_variable_scope": "environment",
  "values": [
    {
      "key": "baseUrl",
      "value": "https://api.local.test",
      "enabled": true
    },
    {
      "key": "thingName",
      "value": "example",
      "enabled": true
    },
    {
      "key": "disabledSecret",
      "value": "ignore-me",
      "enabled": false
    }
  ]
}
